<?xml version="1.0" encoding="utf-8"?>
<?xml-stylesheet href="schema2xhtml.xsl" type="text/xsl"?>

<!-- Test schema for JMRI aspect-signaling support                          -->

<!-- This is an experimental organization,                                  -->
<!-- and will certainly be changed in the near future                       -->

<!-- $Id: aspecttable.xsd,v 1.5 2009-12-30 19:39:13 jacobsen Exp $ -->

<!-- This schema is part of JMRI. Copyright 2009.                           -->
<!--                                                                        -->
<!-- JMRI is free software; you can redistribute it and/or modify it under  -->
<!-- the terms of version 2 of the GNU General Public License as published  -->
<!-- by the Free Software Foundation. See the "COPYING" file for a copy     -->
<!-- of this license.                                                       -->
<!--                                                                        -->
<!-- JMRI is distributed in the hope that it will be useful, but WITHOUT    -->
<!-- ANY WARRANTY; without even the implied warranty of MERCHANTABILITY or  -->
<!-- FITNESS FOR A PARTICULAR PURPOSE.  See the GNU General Public License  -->
<!-- for more details.                                                      -->

<xs:schema xmlns:xs="http://www.w3.org/2001/XMLSchema"
           xmlns:xsi="http://www.w3.org/2001/XMLSchema-instance"
           xmlns:jmri="http://jmri.org/xml/schema/JMRIschema"
           xsi:schemaLocation="http://jmri.org/xml/schema/JMRIschema http://jmri.org/xml/schema/JMRIschema.xsd"
           >
  <xs:element name="aspecttable">
    <xs:annotation>
        <xs:documentation>
        ******** Optional items  **********
        The first instance of each of these
        becomes a property of the signal
        system named bean.
        </xs:documentation>
        <xs:appinfo>
            <jmri:class>jmri.managers.DefaultSignalSystemManager</jmri:class>
        </xs:appinfo>
    </xs:annotation>
    <xs:complexType>
      <xs:sequence>

        <xs:element name="name" minOccurs="1" maxOccurs="1"></xs:element>

        <xs:element name="date" minOccurs="0" maxOccurs="1"></xs:element>
        <xs:element name="reference" minOccurs="0" maxOccurs="unbounded"></xs:element>
        

        <xs:element name="aspects" minOccurs="1" maxOccurs="1">
        <xs:annotation><xs:documentation>
        ******** Required Aspect Table  **********
        </xs:documentation></xs:annotation>
          <xs:complexType>
            <xs:sequence>
              
              <xs:element name="aspect" minOccurs="1" maxOccurs="unbounded">
                <xs:complexType>
                  <xs:annotation><xs:documentation>
                  ******** Optional items  **********
                  The first instance of each of these
                  becomes a property of the specific 
                  aspect.
                  </xs:documentation></xs:annotation>
                  
                  <xs:sequence>
                    
                    <xs:element name="name" minOccurs="1" maxOccurs="1"></xs:element>
                    
                    <xs:element name="title" minOccurs="0" maxOccurs="1"></xs:element>
                    <xs:element name="indication" minOccurs="0" maxOccurs="1"></xs:element>
                    <xs:element name="description" minOccurs="0" maxOccurs="unbounded"></xs:element>
                    <xs:element name="reference" minOccurs="0" maxOccurs="unbounded"></xs:element>
                    <xs:element name="comment" minOccurs="0" maxOccurs="unbounded"></xs:element>
                    <xs:element name="imagelink" minOccurs="0" maxOccurs="unbounded"></xs:element>
                    
                  </xs:sequence>
                </xs:complexType>
              </xs:element>
            </xs:sequence>
          </xs:complexType>
        </xs:element>
                
      </xs:sequence>
    </xs:complexType>
  </xs:element>
</xs:schema>
